id,databases,title,abstract,authors,year,publication_type,published_in,num_references,num_citations,url,doi,pdf
128,"Google Scholar, Web of Science",A Psycho-Lexical Approach to the Assessment of Information Quality on Wikipedia,"The great popularity of Wikipedia makes it one of the dominant knowledge source around the World. However, since one of the core principles of Wikipedia is being open for anyone to maintain it, Wikipedia cannot fully ensure the reliability of its articles, and thus sometimes suffered criticism for containing low-quality information. It is therefore essential to assess the quality of Wikipedia articles automatically. In this paper we describe how we approach that problem by using a psycho-lexical resource, i.e., the Language Inquiry and Word Count (LIWC) dictionary. By training a classifier on different LIWC categories, we discuss the implications of each category for Wikipedia quality assessment.",Qi Su; Pengyuan Liu,2015,Conference,"2015 IEEE/WIC/ACM International Conference on Web Intelligence and Intelligent Agent Technology (WI-IAT), 3, pp. 184-187",18,5,https://www.semanticscholar.org/paper/f5a926ec49dc153326a0aca080377dc0be12e75d,10.1109/WI-IAT.2015.23,
129,Google Scholar,On the Evolution of Quality Flaws and the Effectiveness of Cleanup Tags in the English Wikipedia,"The improvement of information quality is a major task for the free online encyclopedia Wikipedia. Recent studies targeted the analysis and detection of specific quality flaws in Wikipedia articles. To date, quality flaws have been exclusively investigated in current Wikipedia articles, based on a snapshot representing the state of Wikipedia at a certain time. This paper goes further, and provides the first comprehensive breakdown of the evolution of quality flaws in Wikipedia. We utilize cleanup tags to analyze the quality flaws that have been tagged by the Wikipedia community in the English Wikipedia, from its launch in 2001 until 2011. This leads to interesting findings regarding (1) the development of Wikipedia’s quality flaw structure and (2) the usage and the effectiveness of cleanup tags. Specifically, we show that inline tags are more effective than tag boxes, and provide statistics about the considerable volume of rare and non-specific cleanup tags. We expect that this work will support the Wikipedia community in making quality assurance activities more efficient.",Maik Anderka; Benno Stein; M. Busse,2012,Journal,N/A,22,9,https://www.semanticscholar.org/paper/b6aa3e619142d395c01857ec6e7b3b14da8fd0f7,,
130,Google Scholar,,,,,,,,,,,
131,Google Scholar,Assessing the Quality of Wikipedia Pages Using Edit Longevity and Contributor Centrality,"In this paper we address the challenge of assessing the quality of Wikipedia pages using scores derived from edit contribution and con- tributor authoritativeness measures. The hypothesis is that pages with significant contributions from authoritative contributors are likely to be high-quality pages. Contributions are quantified using edit longevity measures and contributor authoritativeness is scored using centrality metrics in either the Wikipedia talk or co-author networks. The results suggest that it is useful to take into account the contributor authori- tativeness when assessing the information quality of Wikipedia content. The percentile visualization of the quality scores provides some insights about the anomalous articles, and can be used to help Wikipedia editors to identify Start and Stub articles that are of relatively good quality.",Xiangju Qin; P. Cunningham,2012,Journal,"ArXiv, abs/1206.2517",20,5,https://www.semanticscholar.org/paper/f621c58c765a3d2a6501a9fbce21681b4d2beb28,,
132,"Google Scholar, Web of Science",Towards Information Quality Assurance in Spanish: Wikipedia,"Featured Articles (FA) are considered to be the best articles that Wikipedia has to offer and in the last years, researchers have found interesting to analyze whether and how they can be distinguished from “ordinary” articles. Likewise, identifying what issues have to be enhanced or fixed in ordinary articles in order to improve their quality is a recent key research trend. Most of the approaches developed to face these information quality problems have been proposed for the English Wikipedia. However, few efforts have been accomplished in Spanish Wikipedia, despite being Spanish, one of the most spoken languages in the world by native speakers. In this respect, we present a breakdown of Spanish Wikipedia’s quality flaw structure. Besides, we carry out studies with three different corpora to automatically assess information quality in Spanish Wikipedia, where FA identification is evaluated as a binary classification task. Our evaluation on a unified setting allows to compare with the English version, the performance achieved by our approach on the Spanish version. The best results obtained show that FA identification in Spanish, can be performed with an F1 score of 0.88 using a document model consisting of only twenty six features and Support Vector Machine as classification algorithm.",E. Ferretti; M. Soria; Sebastián Pérez Casseignau; Lian Pohn; Guido Urquiza; Sergio Alejandro Gómez; M. Errecalde,2017,Journal,"Journal of Computer Science and Technology, 17, pp. 29-36",17,4,https://www.semanticscholar.org/paper/8cba1878de84959de7a5401c9181819ee9bdf205,,
133,Google Scholar,Effects of Implicit Positive Ratings for Quality Assessment of Wikipedia Articles,"In this paper, we propose a method to identify high-quality Wikipedia articles by using implicit positive ratings. One of the major approaches for assessing Wikipedia articles is a text survival ratio based approach. In this approach, when a text survives beyond multiple edits, the text is assessed as high quality. However, the problem is that many low quality articles are misjudged as high quality, because every editor does not always read the whole article. If there is a low quality text at the bottom of a long article, and the text has not seen by the other editors, then the text survives beyond many edits, and the text is assessed as high quality. To solve this problem, we use a section and a paragraph as a unit instead of a whole page. In our method, if an editor edits an article, the system considers that the editor gives positive ratings to the section or the paragraph that the editor edits. From experimental evaluation, we confirmed that the proposed method could improve the accuracy of quality values for articles.",Yumiko Suzuki,2013,Journal,"J. Inf. Process., 21, pp. 342-348",22,3,https://www.semanticscholar.org/paper/ba661edb080125d879bbfe004ae8dc4f1c6b7499,10.2197/IPSJJIP.21.342,https://www.jstage.jst.go.jp/article/ipsjjip/21/2/21_342/_pdf
134,"Google Scholar, Web of Science",Learning with Wikipedia in Higher Education: Academic Performance and Students' Quality Perception,,Antoni Meseguer-Artola; Inma Rodríguez-Ardura; Gisela Ammetller; E. Rimbau-Gilabert,2019,Conference,"Research & Innovation Forum, pp. 117-124",26,1,https://www.semanticscholar.org/paper/a1f353d97743fce8b8ca5ace3b80f1bc9f820f96,10.1007/978-3-030-30809-4_12,
135,Google Scholar,Self-Regulation: How Wikipedia Leverages User-Generated Quality Control Under Section 230,"As Virginia Woolf once wrote, “[T]o enjoy freedom, we have…to control ourselves.” In the market for online information services, Wikipedia has done just that. Wikipedia has achieved astounding success via self-regulation. Wikipedia promotes user-generated quality control not as a legal obligation, but as a commitment to its educational purpose and values of its fact-checking community. In doing so, Wikipedia has leveraged the purpose of Section 230 of the Communications Decency Act into consumer welfare. Section 230 protects sites that engage in ""Good Samaritan"" policing of harmful material, with no requirement on the quality or quantity of such monitoring. Interactive sites should treat the statute an opportunity, rather than mere permission to thrive in the world of Web 2.0: those who can productively self-regulate, should.",Kathleen M. Walsh; Sarah Oh,2010,Unknown,Economics of Networks eJournal,2,4,https://www.semanticscholar.org/paper/f22da6c8f5aea5e111eee39956fea749eae91785,,
136,"ACM, Google Scholar",Assessing the Quality of Wikipedia Articles,"Wikipedia is a very important information reference source for the Internet users. Due to the fact that the content of Wikipedia is the collaborative result from a massive number of participants all over the world, the quality of Wikipedia might be questionable. Over the last decade, many research works are dedicated to solve the issue of Wikipedia quality. In this paper, we present our latest research in determining the quality of Wikipedia articles. The evaluation on the real-world dataset shows that our method outperforms other baseline methods proposed recently.",Quang-Vinh Dang,2021,Conference,2021 The 5th International Conference on Machine Learning and Soft Computing,47,0,https://www.semanticscholar.org/paper/f47fe9e54ef4444ea46e910d9429245bea9d0dfd,10.1145/3453800.3453801,
137,"Google Scholar, Web of Science",Letter to the Editor: Quality of mental health information on Wikipedia,"We read with interest the analysis of the quality of mental health information available online by Reavley et al. (2011) and, as both mental health researchers and Wikipedia editors who have contributed to the articles included in the study, we were encouraged to see this important online resource discussed in Psychological Medicine. As the authors point out, Google searches often yield Wikipedia articles in the first few results ; the ‘schizophrenia ’ article (http://en.wikipedia.org/ wiki/Schizophrenia) had been viewed 369 372 times in the 30 days prior to 20 December 2011 (http://stats. grok.se/). Across all domains except for readability, Wikipedia outperformed Encyclopaedia Britannica, a psychiatry textbook and a number of static information websites from professional bodies. The finding is notable because it contradicts the common stereotype of Wikipedia as being written by lay people, and therefore inaccurate. However, we believe further research is warranted to explore who is editing these articles. While serving as academic researchers, we have made thousands of edits to articles on schizophrenia, neuropsychology, neurodegenerative diseases, conversion disorder and mood-rating scales. This has been done in our spare time out of enjoyment, but we suspect there are many other ‘ lurkers ’ who edit articles using anonymous Internet protocol (IP) addresses to make improvements. It is also worth noting that these are ‘ featured articles ’ which represent the best of Wikipedia, and that not all articles are of this standard. Reavley et al. (2011) suggest professional associations could create Wikipedia task forces and even include statements of approval on articles. Because the ethos of Wikipedia states that a layperson has just as much right to make an edit as a committee of experts, we believe this is probably not the right path to take. We would propose instead that professional bodies support members as individual contributors, rather than ‘ task force members’, to write and maintain informed, current, readable articles in their areas of expertise. This would mean a wider range of professionals could be involved and any perceived conflicts of interest in article content would be avoided. There are three pillars to support such an approach: leadership, education, and incentive. Leadership from the professional bodies of mental health (andmedicine broadly) should recognize that Wikipedia is a go-to source of information that rivals any resource in human history for patients, and that letting poor-quality articles go unimproved is harmful. Education should be provided to train professionals to make appropriate and useful contributions within the context of Wikipedia as a community, rather than just their own academic field. Finally, there must be incentive to motivate experts to contribute ; editing articles should be seen as a positive contribution by promotion boards. Asking experts to donate their time to peerreview and improve the work of others is not new, and peer-reviewing for journals is already something that receives both formal and informal support. There may be an opportunity to improve understanding, reduce stigma and educate patients on a scale not seen before, and although it is a strange new world, we believe it is one with which we all must engage. If readers are interested in participating, searching for ‘WikiProject Medicine ’ (http://en. wikipedia.org/wiki/Wikipedia:WikiProject_Medicine) would be a good place to start.",P. Wicks; V. Bell,2012,Journal,"Psychological Medicine, 42, pp. 891 - 891",1,6,https://www.semanticscholar.org/paper/db0b7c773018080e0401d15272100a2a57272dd5,10.1017/S0033291712000086,https://www.cambridge.org/core/services/aop-cambridge-core/content/view/4C7455808DA13EB100F8C68F6B55FC04/S0033291712000086a.pdf/div-class-title-letter-to-the-editor-quality-of-mental-health-information-on-wikipedia-div.pdf
139,"Google Scholar, Web of Science",Using Morphological and Semantic Features for the Quality Assessment of Russian Wikipedia,,Włodzimierz Lewoniewski; N. Khairova; Krzysztof Węcel; Nataliia Stratiienko; W. Abramowicz,2017,Conference,"International Conference on Information and Software Technologies, pp. 550-560",19,3,https://www.semanticscholar.org/paper/9b06d30b1eafc37b2b90c1f3562d879f7fa2a8aa,10.1007/978-3-319-67642-5_46,
140,"Google Scholar, Web of Science",The Adoption of Wikipedia: A Community- and Information Quality-Based View,"The Web 2.0 model has aroused vast attention as it alters the traditional role of Internet users as pure information receivers. Wikipedia, as one of the most successful case of the Web 2.0 model, creates an online encyclopedia through the collective efforts of volunteers. Shared freely by all Internet users, it forms an online community platform on which users can seek and share knowledge. This study investigates the factors that affect the adoption of Wikipedia. Based on Davis' (1989) TAM, perceived critical mass, community identification, and information quality were incorporated into the research model for explaining the intentions and usage behavior of Wikipedia users. This research is a work-in-progress and a questionnaire survey will be executed, targeting at Internet users who had prior experiences with Wikipedia. The survey is expected to be conducted over the Internet in March, 2008.",Kai Wang; Chien-Liang Lin; Chun-der Chen; Shu-Chen Yang,2008,Conference,"Pacific Asia Conference on Information Systems, pp. 50",56,6,https://www.semanticscholar.org/paper/ea0c5b9d37cb168cc418102e7a934fe7ee2d0e77,,
141,Google Scholar,Cross-lingual Data Quality for Knowledge Base Acceleration Across Wikipedia Editions,"Knowledge-sharing communities like Wikipedia and knowledge bases like Freebase are expected to capture the latest facts about the real world. However, neither of these can keep pace with the rate at which events happen and new knowledge is reported in news and social media. To narrow this gap, we propose an approach to accelerate the online maintenance of knowledge bases. Our method, called LAIKA, is based on link prediction. Wikipedia editions in dierent languages, Wikinews, and other news media come with extensive but noisy interlinkage at the entity level. We utilize this input for recommending, for a given Wikipedia article or knowledge-base entry, new categories, related entities, and cross-lingual interwiki links. LAIKA constructs a large graph from the available input and uses link-overlap measures and random-walk techniques to generate missing links and rank them for recommendations. Experiments with a very large graph from multilingual Wikipedia editions demonstrate the accuracy of our link predictions.",Julianna Göbölös-Szabó; N. Prytkova; M. Spaniol; G. Weikum,2012,Conference,"International Workshop on Quality in Databases, , pp. 1-7",21,7,https://www.semanticscholar.org/paper/e4dda236a443a596dd710ba6dddaba59648caf22,,
142,"ACM, Google Scholar, Web of Science",Quality Assessment of Peer-Produced Content in Knowledge Repositories Using Big Data and Social Networks: The Case of Implicit Collaboration in Wikipedia,"This research provides a method for quality assessment of peer-produced content in knowledge repositories using a complementary view of collaboration. Using the definition of collaboration as the action of working with someone to produce something, we identify the aspects of collaboration that the present research on online communities does not consider. To this end, we introduce and define the concept of implicit collaboration and then identify two dimensions and four possible areas of collaboration. In each area, we identify the relevant social network that captures collaboration. Using customized measures on each of the networks that capture various aspects of collaboration, we quantify the utility of implicit collaboration in assessing article quality. Experiments conducted on the complete population of graded English language Wikipedia articles show that all the identified measures improve the predictive accuracy of the existing models by 11.89 percent while improving the class-wise precision by 9-18 percent and the class-wise recall by 5-26 percent. We also find that our method complements the existing quality assessment approaches well. Our research has implications for developing automated quality assessment methods for peer-produced content using big data and social networks.",Srikar Velichety,2019,Journal,"Data Base, 50, pp. 28-51",79,1,https://www.semanticscholar.org/paper/3739f4702b05af3586dd9ad8d5d37cd924c8c110,10.1145/3371041.3371045,
143,Google Scholar,Knowledge Quality of Collaborative Editing in Wikipedia: an Integrative Perspective of Social Capital and Team Conflict,"Collaborative editing has become one of the most popular forms of knowledge contribution in virtual communities. Wikipedia— the largest online encyclopaedia— is a representative example of collaborative work. Despite the abundant researches on Wikipedia, to the best of our knowledge, no one has considered the integration of social capital and conflict. Besides, extant literatures on knowledge quality just pay attention to task conflict, while relational conflict is rarely mentioned. Meanwhile, our study proposes the nonlinear relationship between task conflict and knowledge quality instead of linear relationships in prior studies. We also postulate the moderating effect of task complexity. Furthermore, there is little empirical research on the influence of social capital on conflict, especially the distinct effects of cognitive and relational capital. This paper aims at proposing a theoretical model to examine the effect of social capital and conflict, meanwhile taking the task complexity into account. We will make our efforts to verify our research model in the following phases, and we believe that the present work can make some contributions to both research and practice.",Liuhan Zhan; Nan Wang; Xiao-Liang Shen; Yongqiang Sun,2015,Conference,"Pacific Asia Conference on Information Systems, pp. 171",27,2,https://www.semanticscholar.org/paper/6ca33772623202bcbcd57f0c996e31518078ff43,,
144,"Google Scholar, Web of Science",Content and Quality of Information about Stroke in Wikipedia across Multiple Languages,"Background: Given the high contribution of stroke to the global burden of disease, there is a need for good-quality information on Web platforms such as Wikipedia. Aims: This study aimed to describe the quality of the Wikipedia articles on stroke written in different languages. Methods: We studied the world’s 30 most spoken languages. With the DISCERN score, we evaluated the quality of the information within the Wikipedia articles. Three investigators assessed each of the texts translated to English. We also registered the word count, the number of references, and if the text referred to the emergency status of stroke, cues to suspect a stroke, and allusions to endovascular treatment. Results: There is a Wikipedia article for stroke in 23 out of the 30 languages. The mean DISCERN score was 35 29.9 ± 9.2. Overall quality ranged from 3/5 in 26.1% to 1/5 in 17.4%. Word count had a mean of 36 3,145.8 ± 3,048.9 words, and the texts included a mean of 43.1 ± 57.3 references; 69.6% of the articles referred to stroke as a medical emergency, 52.2% included awareness symptoms, and 34.8% included endovascular management among the stroke treatments. Three pages included steroids as part of the stroke treatment. The DISCERN score was not correlated with the number of speakers, but it was positively correlated with the number of references (r = 0.90, p < 0.001) and the number of words (r = 0.78, p < 0.001) in the articles. Conclusion: The analyzed Wikipedia articles do not contain relevant and up-to-date information to the general population. Further, the content varies widely across the different languages and is missing for some of them. The missing versions disproportionally affect millions of potential information seekers in undeveloped countries.",J. Marquez-Romero; Ángel Lee; E. Soto-Cabrera; B. Hernández-Curiel; C. Prado-Aguilar,2022,Journal,"European Neurology, 85, pp. 308 - 312",11,0,https://www.semanticscholar.org/paper/796882706963fe29d6febcd63d5f6b6166e76813,10.1159/000521938,
145,"ACM, Google Scholar, Web of Science",Equal opportunities in the access to quality online health information? A multi-lingual study on Wikipedia,"Wikipedia is a free, multilingual, and collaborative online encyclopedia. Nowadays, it is one of the largest sources of online knowledge, often appearing at the top of the results of the major search engines, being one of the most sought-after resources by the public searching for health information. The collaborative nature of Wikipedia raises security concerns since this information is used for decision-making, especially in the health area. Despite being available in hundreds of idioms, there are asymmetries between idioms, namely regarding their quality. In this work, we compare the quality of health information on Wikipedia between idioms with 100 million native speakers or more, and also in Greek, Italian, Korean, Turkish, Persian, Catalan and Hebrew, for historical tradition. Quality metrics are applied to health and medical articles in English, maintained by WikiProject Medicine, and their versions in the above idioms. With this, we contribute to a clarification of the role of Wikipedia in the access to health information. We demonstrate differences in both the quantity and quality of information available between idioms. English is the idiom with the highest quality in general. Urdu, Greek, Indonesian, and Hindi achieved lower values of quality.",Luis Couto; C. Lopes,2021,Conference,Proceedings of the 17th International Symposium on Open Collaboration,38,1,https://www.semanticscholar.org/paper/a5b7aa53662a843c411555aae6508e24e9adcc1c,10.1145/3479986.3480000,https://dl.acm.org/doi/pdf/10.1145/3479986.3480000
146,Google Scholar,Effects of Stigmergic and Explicit Coordination on Wikipedia Article Quality,"Prior research on Wikipedia has noted the importance of both explicit coordination of edits (i.e., through the article Talk page) and stigmergic coordination (i.e., through the article itself). Using a panel data set of article quality and edits for 23 articles over time, we examine the impact of different kinds of edits on article quality. We find that stigmergically-coordinated edits seem to have the biggest effect on quality, but that explicit coordination of major edits also predicts article quality. The findings have implications for both research on coordination in Wikipedia and for supporting editors.",Kevin Crowston; Amira Rezgui,2020,Conference,"Hawaii International Conference on System Sciences, pp. 1-10",28,3,https://www.semanticscholar.org/paper/15ef01000cda62428cdfc3d27cfe21738bd33f2b,10.24251/hicss.2020.287,https://aisel.aisnet.org/cgi/viewcontent.cgi?article=1295&context=hicss-53
147,Google Scholar,Predicting Information Quality Flaws in Wikipedia by Using Classical and Deep Learning Approaches,,Gerónimo Bazán Pereyra; C. Cuello; G. Capodici; Vanessa Jofré; E. Ferretti; Rodolfo Bonnin; M. Errecalde,2019,Conference,"Argentine Congress of Computer Science, pp. 3-18",31,2,https://www.semanticscholar.org/paper/dbf3799d79675e9d4cd8365511fa42556e4967a3,10.1007/978-3-030-48325-8_1,
